iteration	run_name	val_loss	val_accuracy	reward_diff_easy	reward_diff_hard	length_penalty	lambda_easy	lambda_hard	other_changes	status	description
0	baseline_balanced_3	0.8478	0.0	0.0	0.0	0.0	0.0	0.0	none	keep	standard DPO baseline
0	budget_aware_balanced_3	0.8230	0.0	0.0	0.0	0.0	0.05	0.001	none	discard	lambda too small - no divergence from baseline
1	budget_aware_balanced_4	0.6909	0.376	0.0	0.0	0.0	5.0	0.0	none	analyze	better val_loss and accuracy but tokens 2x higher on easy - opposite of goal
2	baseline_balanced_iter2	0.3751	0.02	0.0	0.0	0.0	0.0	0.0	capped50 dataset 10K pairs grad_accum=4	reference	low accuracy due to 20x fewer weight updates
2	budget_aware_balanced_iter2	0.3304	0.01	0.0	0.0	0.0	5.0	0.0	capped50 dataset 10K pairs grad_accum=4	analyze	correct token direction at epoch1 but lost at epoch2 and 1% accuracy
3	baseline_balanced_iter3	1.3360	0.0	0.0	0.0	0.0	0.0	0.0	real_capped100 51K pairs	discard	model collapse - 0% accuracy gibberish output
3	budget_aware_balanced_iter3	1.2013	0.0	0.0	0.0	0.0	5.0	0.0	real_capped100 51K pairs	discard	model collapse - 0% accuracy gibberish output
4	baseline_balanced_iter4	0.6655	0.03	0.0	0.0	0.0	0.0	0.0	lr=1e-6 balanced_v4	discard	too slow learning 3% accuracy
4	budget_aware_balanced_iter4	0.4000	0.0	0.0	0.0	0.0	5.0	0.0	lr=1e-6 KL=0.1 balanced_v4	discard	KL too strong - model frozen
5	budget_aware_balanced_iter5	0.4460	0.38	0.0	0.0	0.0	5.0	0.0	lr=1e-6 KL=0.01 balanced_v4	keep	breakthrough - 22% post-train acc, tokens 177/195
5	baseline_balanced_iter5b	0.0	0.01	0.0	0.0	0.0	0.0	0.0	lr=1e-5 balanced_v4	discard	collapsed - lr too high for v4 data
6	baseline_kl_iter6	0.5703	0.39	0.0	0.0	0.0	0.0	0.0	lr=1e-6 KL=0.01 balanced_v4	keep	fair comparison - 21.2% post-train, tokens 179/198
7a	baseline_1.5b_iter7a	0.7426	0.06	0.0	0.0	0.0	0.0	0.0	1.5B model lr=1e-6 KL=0.01 batch=2	in_progress	1.5B baseline E1 - slow learning 6% acc
7b	budget_1.5b_iter7b	0.4273	0.30	0.0	0.0	0.0	5.0	0.0	1.5B model lr=1e-6 KL=0.01 batch=2	in_progress	1.5B budget E1 - 30% acc, 131.9 easy tokens, strong signal
7c	simpo_budget_0.5b_iter7c	1.5616	0.03	0.0	0.0	0.0	5.0	0.0	SimPO beta=2.0 lr=1e-6	discard	SimPO overfitting - 3% accuracy, val_loss 1.56
7c_v2	simpo_budget_0.5b_iter7c_v2	1.6498	0.05	0.0	0.0	0.0	5.0	0.0	SimPO beta=0.5 lr=5e-7	discard	SimPO still overfitting with lower beta
7b_e2	budget_1.5b_iter7b	0.4240	0.43	0.0	0.0	0.0	5.0	0.0	1.5B model lr=1e-6 KL=0.01 batch=2	keep	post-train: 25.8% acc, TPCA 811.5, 13% better than baseline
9	baseline_1.5b_noKL_iter9	0.6125	0.10	0.0	0.0	0.0	0.0	0.0	1.5B model lr=1e-6 KL=0.0 batch=2	in_progress	noKL baseline E1: 10% acc, 74 easy tokens, 1298 TPCA
7a	baseline_1.5b_iter7a	0.7426	0.06	0.0	0.0	0.0	0.0	0.0	1.5B model lr=1e-6 KL=0.01 batch=2	running	E1: 6% acc, tokens 149/179 - needs more epochs
7b	budget_1.5b_iter7b	0.4273	0.30	0.0	0.0	0.0	5.0	0.0	1.5B model lr=1e-6 KL=0.01 batch=2	running	E1: 30% acc, tokens 132/248 - BREAKTHROUGH shortest easy tokens
7c	simpo_budget_0.5b_iter7c	1.5616	0.03	0.0	0.0	0.0	5.0	0.0	SimPO beta=2.0 lr=1e-6	discard	SimPO overfits - 3% acc, saturated by E2
7c-v2	simpo_budget_0.5b_iter7c_v2	1.6498	0.05	0.0	0.0	0.0	5.0	0.0	SimPO beta=0.5 lr=5e-7	discard	SimPO still overfits - 5% acc, tokens 239 (longer)
